id;question;options;correctAnswer;Category
1;Which ITIL guiding principle recommends using existing services, processes and tools when improving services?;['Progress iteratively with feedback', 'Keep is simple and practical', 'Start where you are', 'Focus on value'];Start where you are;guiding principle
2;Which practice has a purpose that includes ensuring that risks have been properly assessed?;['Service configuration management', 'Problem management', 'Service level management', 'Change control'];Change control;chenge
3;When should a full risk assessment and authorization be carried out for a standard change?;['Each time the standard change is implemented', 'When the procedure for the standard change is created', 'At least once a year', 'When an emergency change is requested'];When the procedure for the standard change is created;chenge
4;Which statement about emergency changes is CORRECT?;['The testing of emergency can be eliminated in order to implement the change quickly', 'The assessment and authorization of emergency changes is expedited to ensure they can be implemented quickly', 'Emergency changes should be authorized and implemented as service requests', 'Emergency changes must be fully documented before authorization and implementation'];The assessment and authorization of emergency changes is expedited to ensure they can be implemented quickly;problem/incident/emergency
5;Which practice coordinates the classification, ownership and communication of service requests and incidents?;['Supplier management', 'Service desk', 'Problem management', 'Relationship management'];Service desk;service desk
6;What is warranty?;['Assurance that a product or service will meet agreed requirements', 'The amount of money spent on a specific activity or resource', 'The functionality offered by a product or service to meet a particular need', 'The perceived benefits, usefulness and importance of something'];Assurance that a product or service will meet agreed requirements;service
7;Which is part of service provision?;['The management of resources configured to deliver the service', 'The management of resources needed to consume the service', 'The grouping of one or more services based on one or more products', 'The joint activities performed to ensure continual value co-creation'];The management of resources configured to deliver the service;management
8;Which statement about a 'continual improvement register' is CORRECT?;['It should be managed at the senior level of the organization', 'It should be used to capture user demand', 'There should only be one for the whole organization', 'It should be re-prioritized as ideas are documented'];It should be re-prioritized as ideas are documented;guiding principle
9;What are 'engage', 'plan' and 'improve' examples of?;['Service value chain activities', 'Service level management', 'Service value chain inputs', 'Change control'];Service value chain activities;value chain
10;Which statement about outcomes is CORRECT?;['An outcome can be enabled by more than one output', 'Outcomes are how the service performs', 'An output can be enabled by one or more outcomes', 'An outcome is a tangible or intangible activity'];An outcome can be enabled by more than one output;service
11;Which statement about service desks is CORRECT?;['The service desk should work in close collaboration with support and development teams', 'The service desk should rely on self-service portals instead of escalation to support teams', 'The service desk should remain isolated from technical support teams', 'The service desk should escalate all technical issues to support and development teams'];The service desk should work in close collaboration with support and development teams;service desk
12;Which practice updates information relating to symptoms and business impact?;['Service level management', 'Change control', 'Service request management', 'Incident management'];Incident management;problem/incident/emergency
13;Which is included in the purpose of the 'design and transition' value chain activity?;['Ensuring that service components are available when needed', 'Providing transparency and good stakeholder relationships', 'Supporting services according to specifications', 'Continually meeting stakeholder expectations for costs'];Continually meeting stakeholder expectations for costs;value chain
14;Which practice has a purpose to support the quality of the service by handling all agreed user initiated service requests?;['Change control', 'IT asset management', 'Service desk', 'Service request management'];Service request management;service desk
15;Which is NOT a component of the service value system?;['The guiding principles', 'Governance', 'Practices', 'The four dimensions of service management'];The four dimensions of service management;management
16;Which statement about the steps to fulfill a service request is CORRECT?;['They should be complex and detailed', 'They should be well-known and proven', 'They should include incident handling', 'They should be brief and simple'];They should be well-known and proven;service
17;Which guiding principle recommends eliminating activities that do not contribute to the creation of value?;['Start where you are', 'Collaborate and promote visibility', 'Keep it simple and practical', 'Optimize and automate'];Keep it simple and practical;guiding principle
18;When should the effectiveness of a problem workaround be assessed?;['Whenever the workaround is used', 'Whenever the problem is resolved', 'Whenever the workaround becomes a known error', 'Whenever the problem is prioritized'];Whenever the workaround is used;problem/incident/emergency
19;Identify the missing word in the following sentence.<br>A change is defined as the addition, modification, or removal of anything that could have a direct or indirect effect on [?].;['assets', 'values', 'elements', 'services'];services;chenge
20;Which dimension considers how knowledge assets should be protected?;['Organizations and people', 'Partners and suppliers', 'Information and technology', 'Value streams and processes'];Information and technology;service
21;What is a means of enabling value co-creation by facilitating outcomes that customers want to achieve, without the customer having to manage specific costs and risks?;['Service management', 'Continual improvement', 'A service', 'An IT asset'];A service;service
22;Identify the missing words in the following sentence.<br>The management of information security incidents usually requires [?].;['Immediate escalation', 'Specialist teams', 'A separate process', 'Third party support'];A separate process;problem/incident/emergency
23;What are the ITIL guiding principles used for?;"['To help an organization make good decisions', 'To direct and control an organization', 'To identify activities that an organization must perform in order to deliver a valuable service', ""To ensure that an organization's performance continually meets stakeholders' expectations""]";To help an organization make good decisions;guiding principle
24;Which is the CORRECT approach for managing a large improvement initiative as smaller iterations?;['Each iteration should be designed before starting the initiative and implemented without feedback', 'Feedback should only be taken into account when one iteration fails to meet its objective', 'Feedback should be reduced for large improvements as it is unlikely that circumstances will change', 'Each iteration should be continually re-evaluated based on feedback'];Each iteration should be continually re-evaluated based on feedback;guiding principle
25;What is the purpose of the 'deployment management' practice?;['To ensure services achieve agreed and expected performance', 'To make new or changed services available for use', 'To move new or changed components to live environments', 'To set clear business-based targets for service performance'];To move new or changed components to live environments;management
26;Which is a service request?;['Requesting a workaround for an issue', 'Requesting information about how to create a document', 'Requesting an enhancement to an application', 'Requesting investigation of a degraded service'];Requesting information about how to create a document;service
27;Identify the missing word in the following sentence.<br>The purpose of the supplier management practice is to ensure that the organization's suppliers and their [?] are managed appropriately to support the seamless provision of quality products and services.;['costs', 'users', 'value', 'performances'];performances;management
28;What is a recommendation of the 'focus on value' guiding principle?;"[""Make 'focus on value' a responsibility of the management"", 'Focus on the value of new and significant projects first', 'Focus on value for the service provider first', 'Focus on value at every step of the improvement']";Focus on value at every step of the improvement;guiding principle
29;Which guiding principle recommends standardizing and streamlining manual tasks?;['Optimize and automate', 'Collaborate and promote visibility', 'Focus on value', 'Think and work holistically'];Optimize and automate;guiding principle
30;Which describes a set of defined steps for implementing improvements?;"[""The 'improve' value chain activity"", ""The 'continual improvement register'"", ""The 'continual improvement model'"", ""The 'engage' value chain activity""]";The 'continual improvement model';guiding principle
31;Which is a key requirement for a successful service level agreement?;"['It should be written in legal language', 'It should be simply written and easy to understand', ""It should be based on the service provider's view of the service"", 'It should relate to simple operational metrics']";It should be simply written and easy to understand;service
32;When planning 'continual improvement', which approach for assessing the current state of a service is CORRECT?;['An organization should always use a single technique to ensure metrics are consistent', 'An organization should always use a strength, weakness, opportunity and threat (SWOT) analysis', 'An organization should always develop competencies in methodologies and techniques that will meet their needs', 'An organization should always use an approach that combines Lean, Agile and DevOps methodologies'];An organization should always develop competencies in methodologies and techniques that will meet their needs;guiding principle
33;How does a service consumer contribute to the reduction of disk?;['By paying for the service', 'By managing server hardware', 'By communicating constraints', 'By managing staff availability'];By communicating constraints;service
34;What helps diagnose and resolve a simple incident?;['Rapid escalation', 'Formation of a temporary team', 'The use of scripts', 'Problem prioritization'];The use of scripts;problem/incident/emergency
35;Which ITIL practice has a purpose that includes reducing the likelihood of incidents?;['Change control', 'Continual improvement', 'Problem management', 'Service desk'];Problem management;problem/incident/emergency
36;Which service level metrics are BEST for measuring user experience?;['Single system-based metrics', 'Metrics for the percentage of uptime of a service', 'Operational metrics', 'Metrics linked to defined outcomes'];Metrics linked to defined outcomes;service
37;What are the MOST important skills required by service desk staff?;['Incident analysis skills', 'Technical skills', 'Problem resolution skills', 'Supplier management skills'];Incident analysis skills;service desk
38;Which TWO statements about an organization's culture are CORRECT? (Choose two.)<br>1. It is created from shared values based on how it carries out its work<br>2. It is determined by the type of technology used to support services<br>3. It should be based on the culture of prospective suppliers<br>4. It should be based on the objectives of the organization;['1 and 2', '2 and 3', '3 and 4', '1 and 4'];1 and 4;service
39;When should a change request be submitted to resolve a problem?;['As soon as a solution for the problem has been identified', 'As soon as a workaround for the problem has been identified', 'As soon as the analysis of the frequency and impact of incidents justifies the change', 'As soon as the analysis of cost, risks and benefits justifies the change'];As soon as the analysis of cost, risks and benefits justifies the change;problem/incident/emergency
40;Which guiding principle helps to ensure that better information is available for decision making?;['Keep it simple and practical', 'Collaborate and promote visibility', 'Optimize and automate', 'Think and work holistically'];Collaborate and promote visibility;guiding principle
41;Which practice has a purpose that includes observing a service to report selected changes of state identified as events?;['Incident management', 'Monitoring and event management', 'Change control', 'Information security management'];Information security management;management
42;Which describes a standard change?;['A high-risk change that needs very thorough assessment', 'A change that is typically implemented as a service request', 'A change that must be implemented as soon as possible', 'A change that needs to be scheduled, assessed and authorized following a defined process'];A change that is typically implemented as a service request;chenge
43;How does information about problems and known errors contribute to 'incident management'?;['It enables the reassessment of known erros', 'It enables quick and efficient diagnosis of incidents', 'It removes the need for collaboration during incident resolution', 'It removes the need for regular customer updates'];It enables quick and efficient diagnosis of incidents;problem/incident/emergency
44;Which practice owns and manages issues, queries and requests from users?;['Service desk', 'Problem management', 'Incident management', 'Change control'];Service desk;service desk
45;What defines the requirements for a service and takes responsibility for the outcomes of service consumption?;['A customer', 'A user', 'A configuration item (CI)', 'An IT asset'];A customer;service
46;Which stakeholders co-create value in a service relationship?;['Investor and consumer', 'Investor and supplier', 'Consumer and provider', 'Provider and supplier'];Consumer and provider;service
47;Which describes normal changes?;['Changes that need to be scheduled and assessed following a process', 'Changes that are low-risk and pre-authorized', 'Changes that are typically initiated as service requests', 'Changes that must be implemented as soon as possible'];Changes that need to be scheduled and assessed following a process;chenge
48;What is the expected outcome from using a service value chain?;['Service value streams', 'Value realization', 'Customer engagement', 'The application of practices'];Value realization;value chain
49;Which statement about outcomes is CORRECT?;['Outcomes help service consumers achieve outputs', 'Outcomes are one or more services that fulfil the needs of a service consumer', 'Service providers help service consumers achieve outcomes', 'Helping service consumers achieve outcomes reduces service provider costs'];Service providers help service consumers achieve outcomes;service
50;Which skill is an essential part of the 'service level management' practice?;['Problem analysis', 'Technical knowledge', 'Listening', 'Diagnosis'];Listening;management
51;What are the three phases of 'problem management'?;['Problem identification, problem control, error control', 'Problem analysis, error identification, incident resolution', 'Problem logging, problem classification, problem resolution', 'Incident management, problem management, change control'];Problem identification, problem control, error control;problem/incident/emergency
52;Which is a purpose of the 'engage' value chain activity?;"['Meeting expectations for quality, costs and time-to-market', 'Ensuring the continual improvement of services', ""Ensuring that the organization's vision is understood"", 'Providing transparency and good relationships']";Providing transparency and good relationships;value chain
53;Identify the missing word in the following sentence.<br>The purpose of the service configuration management practice is to ensure that accurate and reliable information about the configuration of services, and the [?] that support them, is available when and where it is needed.;['suppliers', 'assets', 'customers', 'CIs'];CIs;management
54;What is described by the service value system?;['How to apply the systems approach of the guiding principle think and work holistically', 'Services based on one or more products, designed to address needs of a target consumer group', 'How all the components and activities of the organization work together as a system to enable value creation', 'Joint activities performed by a service provider and a service consumer to ensure continual value co-creation'];How all the components and activities of the organization work together as a system to enable value creation;value chain
55;What is defined as any component that needs to be managed in order to deliver an IT service?;['A service request', 'An IT asset', 'A configuration item (CI)', 'An incident'];A configuration item (CI);service
56;Which guiding principle recommends using the minimum number of steps necessary to achieve an objective?;['Progress iteratively with feedback', 'Think and work holistically', 'Keep it simple and practical', 'Focus on value'];Keep it simple and practical;guiding principle
57;Which TWO statements about the 'service request management' practice are CORRECT?<br>1. Service requests are part of normal service delivery<br>2. Complaints can be handled as service requests<br>3. Service requests result from a failure in service<br>4. Normal changes should be handled as service requests;['3 and 4', '2 and 3', '1 and 4', '1 and 2'];1 and 2;management
58;What is an IT asset?;['The removal of anything that could have a direct or indirect effect on services', 'Any component that needs to be managed in order to deliver a service', 'A request from a user that initiates a service action', 'Any financially valuable component that can contribute to delivery of an IT product or service'];Any financially valuable component that can contribute to delivery of an IT product or service;service
59;Which dimension includes a workflow management system?;['Value streams and processes', 'Partners and suppliers', 'Information and technology', 'Organizations and people'];Value streams and processes;value chain
60;Identify the missing word in the following sentence.<br>A service is a means of enabling value co-creation by facilitating outcomes that customers want to achieve, without the customer having to manage specific [?] and risks.;['information', 'utility', 'warranty', 'costs'];costs;service
61;Which of these should be logged and managed as a problem?;"['Trend analysis shows a large number of similar incidents', 'A user requests delivery of a laptop', 'A monitoring tool detects a change of state for a service', ""'Continual improvement' needs to prioritize an improvement opportunity""]";Trend analysis shows a large number of similar incidents;problem/incident/emergency
62;In which TWO situations should the ITIL guiding principles be considered?<br>1. In every initiative<br>2. In relationships with all stakeholders<br>3. Only in specific initiatives where the principle is relevant<br>4. Only in specific stakeholder relationships where the principle is relevant;['1 and 2', '1 and 4', '2 and 3', '3 and 4'];1 and 2;guiding principle
63;Which guiding principle recommends coordinating all dimensions of service management?;['Start where you are', 'Think and work holistically', 'Keep it simple and practical', 'Progress iteratively with feedback'];Think and work holistically;management
64;What is the purpose of the 'relationship management' practice?;"['To support the agreed quality of a service handling all agreed, userinitiated service requests', 'To set clear business-based targets for service performance', 'To establish and nurture the links between the organization and its stakeholders', ""To align the organization's practices and services with changing business needs""]";To establish and nurture the links between the organization and its stakeholders;management
65;How should the workflow for a new service request be designed?;['Use a single workflow for all types of service request', 'Leverage existing workflows whenever possible', 'Use different workflows for each type of service request', 'Avoid workflows for simple service requests'];Leverage existing workflows whenever possible;service
66;What is the purpose of the 'information security management1 practice?;['To ensure that accurate and reliable information about the configuration of services is available when and where it is needed', 'To observe services and service components', 'To protect the information needed by the organization to conduct its business', 'To plan and manage the full lifecycle of all IT assets'];To protect the information needed by the organization to conduct its business;management
67;Identify the missing word in the following sentence.<br>The use of [?] should support, not replace what is observed, when using the 'start where you are1 guiding principle.;['plans', 'measurement', 'process', 'tools'];measurement;guiding principle
68;How should automation be implemented?;['By initially concentrating on the most complex tasks', 'By optimizing as much as possible first', 'By replacing human intervention wherever possible', 'By replacing the existing tools first'];By replacing human intervention wherever possible;guiding principle
69;Which activity is part of the 'continual improvement' practice?;['Populating and maintaining the asset register', 'Providing a clear path for users to report issues, queries, and requests', 'Delivering tactical and operational engagement with customers', 'Identifying and logging opportunities'];Identifying and logging opportunities;guiding principle
70;Which competencies are required by the 'service level management' practice?;['Problem investigation and resolution', 'Incident analysis and prioritization', 'Business analysis and commercial management', 'Balanced scorecard reviews and maturity assessment'];Business analysis and commercial management;management
71;Which practice uses techniques such as SWOT analysis, balanced scorecard reviews, and maturity assessments?;['Incident management', 'Continual improvement', 'Service request management', 'Problem management'];Continual improvement;guiding principle
72;Which statement about costs is CORRECT?;['Costs removed from the consumer are part of service consumption', 'Costs imposed on the consumer are costs of service utility', 'Costs removed from the consumer are part of the value proposition', 'Costs imposed on the consumer are costs of service warranty'];Costs removed from the consumer are part of the value proposition;value chain
73;What is typically needed to assign complex incidents to support groups?;['The incident priority', 'The incident category', 'A change schedule', 'A self-help tool'];The incident category;problem/incident/emergency
74;Which practice has a purpose that includes aligning the organization's practices and services with changing business needs?;['Relationship management', 'Continual improvement', 'Service configuration management', 'Service level management'];Continual improvement;service
75;A major incident has been closed, but there is a risk that it might happen again. How should this be logged and managed?;['As an event', 'As a problem', 'As a service request', 'As a change request'];As a problem;problem/incident/emergency
76;What should be done to determine the appropriate metrics for measuring a new service?;['Measuring the performance over the first six months, and basing a solution on the results', 'Asking customers to provide numerical targets that meet their needs', 'Using operational data to provide detailed service reports', 'Asking customers open questions to establish their requirements'];Using operational data to provide detailed service reports;service
77;Which dimension includes activities and workflows?;['Value streams and processes', 'Partners and suppliers', 'Information and technology', 'Organizations and people'];Value streams and processes;value chain
78;What should be used to set user expectations for request fulfilment times?;['The consumer demand for the service', 'The time that the customer indicates for service delivery', 'The service levels of the supplier', 'The time needed to realistically deliver the service'];The time needed to realistically deliver the service;service
79;Which describes outcomes?;"['Tangible or intangible deliverables', 'Results desired by a stakeholder', ""Configuration of an organization's resources"", 'Functionality offered by a product or service']";Results desired by a stakeholder;service
80;How should an organization adopt continual improvement methods?;['Use a new method for each improvement the organization handles', 'Select a few key methods for the types of improvement that the organization handles', 'Build the capability to use as many improvement methods as possible', 'Select a single method for all improvements that the organization handles'];Select a few key methods for the types of improvement that the organization handles;guiding principle
81;Which is a key consideration for the guiding principle 'keep it simple and practical'?;['Try to create a solution for every exception', 'Start with a complex solution, then simplify', 'Understand how each element contributes to value creation', 'Ignore the conflicting objectives of different stakeholders'];Understand how each element contributes to value creation;guiding principle
