id;question;options;correctAnswer;Category
245;What does 'change enablement' PRIMARILY focus on?;['Changes to service levels', 'Changes to products and services', 'Changes to organizational structure', 'Changes to skills and competencies'];Changes to products and services;chenge
246;Identify the missing word(s) in the following sentence.<br>The service desk should be the entry point and single point of contact for the [?] with all of its users.;['Service consumer', 'Service provider', 'Customer', 'Supplier'];Service provider;service desk
247;Which is handled as a service request?;['An investigation to identify the cause of an incident', 'A compliment about an IT support team', 'The failure of an IT service', 'An emergency change to implement a security patch'];The failure of an IT service;service
248;Which is a key requirement for a successful service level agreement (SLA)?;['Using individual metrics that relate to the service catalogue', 'Using bundled metrics to relate performance to outcomes', 'Using single-system-based metrics that relate to outputs', 'Using an agreement between the service provider and service supplier'];Using bundled metrics to relate performance to outcomes;service
249;Which is considered by the 'partners and suppliers' dimension?;['Using artificial intelligence', 'Defining controls and procedures', 'Using formal roles and responsibilities', 'Working with an integrator to manage relationships'];Working with an integrator to manage relationships;service
250;Which practice recommends using tools for collaboration and the automated matching of symptoms?;['Problem management', 'Service level management', 'Incident management', 'Service request management'];Incident management;problem/incident/emergency
251;Which helps to manage an incident when it is unclear which support team should be working on the incident?;['Disaster recovery plans', 'Swarming', 'Target resolution times', 'Self-help'];Swarming;problem/incident/emergency
252;Which statement about the 'continual improvement' practice is CORRECT?;['Continual improvement participation should be limited to a small dedicated team.', 'It is the role of senior management to authorize improvement initiatives.', 'Training should be provided to those involved in continual improvement.', 'A single continual improvement register should be maintained by senior management.'];It is the role of senior management to authorize improvement initiatives.;management
253;Which does the ITIL service value system discourage?;['Coordinated authorities and responsibilities', 'Organizational silos', 'Interfaces among practices', 'Organizational agility'];Organizational silos;service
254;An SLA is a service level agreement. Which describes the 'watermelon SLA' effect?;"[""A single SLA defines target service levels for multiple customer, so every customer sees reports about other customers' experiences."", 'The metrics in an SLA are focused on internal measures, so that reports show everything is good, while the customer is not satisfied.', 'SLA targets change very frequently, so that each report includes new measures and trends cannot be analyzed.', 'Introducing SLAs for a service enables customer to see that the service provider is doing a really good job, so this improves satisfaction.']";The metrics in an SLA are focused on internal measures, so that reports show everything is good, while the customer is not satisfied.;service
255;Which practice includes conducting regular reviews to ensure that services are still appropriate and relevant?;['Service level management', 'Service desk', 'Continual improvement', 'Change enablement'];Service level management;management
256;What is a service?;['A possible event that could cause harm or loss, or make it more difficult to achieve objectives', 'A means of enabling value co-creation by facilitating outcomes that customers want to achieve, without the customer having to manage specific costs and risks', 'A tangible or intangible deliverable of an activity', 'Joint activities performed by a service provider and a service consumer to ensure continual value co- creation based on agreed and available service offerings'];A means of enabling value co-creation by facilitating outcomes that customers want to achieve, without the customer having to manage specific costs and risks;value chain
257;Which TWO are important aspects of the 'service request management' practice?<br>1. Standardization and automation<br>2. Providing a variety of channels for access<br>3. Establishing a shared view of targets<br>4. Policies for approvals;['1 and 2', '2 and 3', '3 and 4', '1 and 4'];1 and 2;management
258;What is required by all service desk staff?;['Excellent technical knowledge', 'Root cause analysis skills', 'Demonstration of emotional intelligence', 'Knowledge of telephony technology'];Demonstration of emotional intelligence;service desk
259;Which practice establishes a channel between the service provider and its users?;['Relationship management', 'Change enablement', 'Supplier management', 'Service desk'];Service desk;service desk
260;Which practice includes the use of approaches such as Lean, Agile and DevOps with the aim of facilitating a greater amount of change at a quicker rate?;['Service desk', 'Monitoring and event management', 'Service level management', 'Continual improvement'];Service level management;management
261;Which practice has a purpose that includes maximizing success by ensuring that risks have been properly assessed?;['Relationship management', 'Change control', 'Release management', 'Monitoring and event management'];Change control;chenge
262;Which practice provides users with a way to get various requests arranged, explained and coordinated?;['Service level management', 'Relationship management', 'Continual improvement', 'Service desk'];Service desk;service desk
263;Which helps to streamline the fulfilment of service requests?;['Understanding which service requests can be accomplished with limited approvals', 'Creating new workflows for every service request', 'Separating requests relating to service failures from the degradation of services', 'Eliminating service requests which have complex workflows'];Understanding which service requests can be accomplished with limited approvals;service
264;Which statement about outcomes is CORRECT?;['They are deliverables provided to service consumers.', 'They allow service consumers to achieve a desired result.', 'They provide products to service providers based on outputs.', 'The co-create value for service providers by reducing costs and risks.'];They allow service consumers to achieve a desired result.;service
265;Which guiding principle says that services and processes should NOT provide a solution for every exception?;['Keep it simple and practical', 'Think and work holistically', 'Optimize and automate', 'Collaborate and promote visibility'];Keep it simple and practical;guiding principle
266;Identify the missing word in the following sentence.<br>The purpose of the 'supplier management' practice is to ensure that the organization's suppliers and their performances are [?] appropriately to support the seamless provision of quality products and services.;['measured', 'rewarded', 'managed', 'defined'];managed;management
267;Identify the missing word in the following sentence.<br>The purpose of the service configuration management practice is to ensure that accurate and reliable information about the [?], and the CIs that support them, is available when and where it is needed.;['relationships with suppliers', 'configuration of services', 'skills of people', 'authorization of changes'];configuration of services;management
268;Which practice requires skills and competencies related to business analysis, supplier management and relationship management?;['Monitoring and event management', 'Incident management', 'Service level management', 'IT asset management'];Service level management;management
269;When should a workaround be created?;['As soon as possible, once the incident is logged', 'After the resolution of a problem', 'When a problem cannot be resolved quickly', 'When a potential permanent solution has been identified'];When a problem cannot be resolved quickly;problem/incident/emergency
270;What is a configuration item?;['Any financially valuable component that can contribute to delivery of an IT product or service', 'Any component that needs to be managed in order to deliver an IT service', 'Any change of state that has significance for the management of a service', 'A problem that has been analyzed but has not been resolved'];Any component that needs to be managed in order to deliver an IT service;service
271;Identify the missing words in the following sentence.<br>When an organization has decided to improve a service, it should start by considering [?].;['existing information', 'new methods', 'additional measurements', 'revised processes'];existing information;service
272;Which is a use of the change schedule?;['Assigning resources to changes', 'Deciding the approval authority for changes', 'Automating the change process', 'Creating change models'];Assigning resources to changes;chenge
273;Which dimension of service management considers the workflows and controls needed to deliver services?;['Organization and people', 'Information and technology', 'Partners and suppliers', 'Value streams and processes'];Value streams and processes;value chain
274;Which guiding principle considers how the steps of a process can be performed as efficiently as possible?;['Start where you are', 'Focus on value', 'Think and work holistically', 'Optimize and automate'];Optimize and automate;guiding principle
275;Which statement about the 'incident management' practice is CORRECT?;['It identifies the cause of major incidents.', 'It authorizes changes to resolve incidents.', 'It maintains detailed procedures for diagnosing incidents.', 'It resolves the highest impact incidents first.'];It resolves the highest impact incidents first.;problem/incident/emergency
276;How should an organization prioritize incidents?;['Ask the user for their preferred resolution timeframe.', 'Assess the availability of the appropriate support team.', 'Use an agreed classification which is based on the business impact of the incident.', 'Create an order of incidents based on the dates and times when they were logged.'];Use an agreed classification which is based on the business impact of the incident.;problem/incident/emergency
277;Which is a purpose of the 'relationship management' practice?;['To systematically observe services and service components', 'To protect the information needed by the organization to conduct its business', 'To be the entry point and single point of contact for the service provider with all of its users', 'To identify, analyze, monitor, and continually improve links with stakeholders'];To identify, analyze, monitor, and continually improve links with stakeholders;management
278;Which statement about problems is CORRECT?;['Problems are not related to incidents.', 'Problems must be resolved quickly in order to restore normal business activity.', 'Problem analysis should focus on one of the four dimensions to achieve a fast diagnosis.', 'Problem prioritization involves risk assessment.'];Problem prioritization involves risk assessment.;problem/incident/emergency
279;Which is a risk that might be removed from a service consumer by an IT service?;['Service provider ceasing to trade', 'Security breach', 'Failure of server hardware', 'Cost of purchasing servers'];Security breach;service
280;Which is one of the MAIN concerns of the 'design and transition' value chain activity?;"[""Understanding the organization's vision"", 'Understanding stakeholder needs', 'Meeting stakeholder expectations', 'Ensuring service components are available']";Meeting stakeholder expectations;value chain
281;Which is a result of applying the guiding principle 'progress iteratively with feedback'?;"['The ability to discover and respond to failure earlier', 'Standardization of practices and services', ""Understanding the customer's perception of value"", 'Understanding the current state and identifying what can be reused']";The ability to discover and respond to failure earlier;guiding principle
282;Which practice is responsible for moving new or changed components to live or other environments?;['Release management', 'Deployment management', 'Change enablement', 'Supplier management'];Deployment management;management
283;Which should be handled by 'service request management'?;['A request to implement a security patch', 'A request to provide a laptop', 'A request to resolve an error in a service', 'A request to change a target in a service level agreement'];A request to provide a laptop;service desk
284;What can help to reduce resistance to a planned improvement when applying the guiding principle 'collaborate and promote visibility'?;['Restricting information about the improvement to essential stakeholders only.', 'Increasing collaboration and visibility for the improvement.', 'Involving customers after all planning has been completed.', 'Engaging every stakeholder group in the same way, with the same communication.'];Involving customers after all planning has been completed.;guiding principle
285;What can be described as an operating model for the creating and management of products and services?;['Governance', 'Service value chain', 'Guiding principles', 'Practices'];Service value chain;value chain
286;What is a definition of a problem?;['An unplanned interruption to a service, or reduction in the quality of a service', 'A cause, or potential cause, of one or more incidents', 'An incident for which a full resolution is not yet available', 'Any change of state that has significance for the management of a configuration item (CI)'];A cause, or potential cause, of one or more incidents;problem/incident/emergency
287;Which action is performed by a service provider?;['Requesting required service actions', 'Authorizing budget for service consumption', 'Ensuring access to agreed resources', 'Receiving of the agreed goods'];Ensuring access to agreed resources;service
288;Which statement about 'continual improvement' is CORRECT?;"[""All improvement ideas should be logged in a single 'continual improvement register'"", ""A single team should carry out 'continual improvement' across the organization"", ""'Continual improvement' should have minimal interaction with other practices"", ""Everyone in the organization is responsible for some aspects of 'continual improvement'""]";Everyone in the organization is responsible for some aspects of 'continual improvement';guiding principle
289;Which step of the continual improvement model includes baseline assessments?;['Did we get there?', 'Where are we now?', 'What is the vision?', 'Where do we want to be?'];Where do we want to be?;guiding principle
290;Which describes a 'change authority'?;['A model used to determine who will assess a change', 'A person who approves a change', 'A tool used to help changes', 'A way to manage the people aspects of change'];A person who approves a change;chenge
291;Which is NOT a component of the service value system?;['The service value chain', 'Opportunity and demand', 'Continual improvement', 'Governance'];Opportunity and demand;service
292;Which practice has a strong influence on the user experience and perception of the service provider?;['Service desk', 'Change enablement', 'Service level management', 'Supplier management'];Service level management;management
293;Which statement about service relationship management is CORRECT?;['It focuses on the service actions performed by users', 'It requires the service consumer to create resources for the service provider', 'It requires co-operation of both the service provider and service consumer', 'It focuses on the fulfilment of the agreed service actions'];It requires co-operation of both the service provider and service consumer;management
294;What is the MOST important reason for prioritizing incidents?;['To ensure that user expectations are realistic', 'To ensure that incidents with highest impact are resolved first', 'To help information-sharing are learning', 'To provide links to related changes and known errors'];To ensure that incidents with highest impact are resolved first;problem/incident/emergency
295;Which 'service level management' activity helps staff to deliver a more business-focused service?;['Creating targets based on the percentage of uptime of a service', 'Understanding the ongoing requirements of customers', 'Using complex technical terminology in service level agreements (SLAs)', 'Measuring low-level operational activities'];Understanding the ongoing requirements of customers;management
296;Which practice has a purpose that includes the handling of pre-defined, user-initiated demands for service?;['Service request management', 'Service configuration management', 'Deployment management', 'Change enablement'];Service request management;service desk
297;Which guiding principle considers which parts of an existing process should be kept by identifying how they contribute to value creation?;['Progress iteratively with feedback', 'Collaborate and promote visibility', 'Think and work holistically', 'Keep it simple and practical'];Keep it simple and practical;guiding principle
298;What is the purpose of the 'monitoring and event management' practice?;['To restore normal service operation as quickly as possible', 'To manage workarounds and known errors', 'To capture demand for incident resolution and service requests', 'To systematically observe services and service components'];To systematically observe services and service components;management
299;Which statement about outcome is CORRECT?;['Outcomes rely on outputs to deliver results for a stakeholder', 'Outcomes use activities to produce tangible or intangible deliverables', 'Outcomes give service consumers assurance of products or services', 'Outcomes help a service consumer to assess the cost of a specific activity'];Outcomes rely on outputs to deliver results for a stakeholder;service
300;Which skill is required by the 'service level management' practice?;['Supplier management', 'Technical expertise', 'Event monitoring', 'Problem management'];Supplier management;management
301;Which statement about the 'continual improvement model' is CORRECT?;['Organizations should work through the steps of the model in the sequence in which they are presented', 'The flow of the model helps organizations to link improvements to its goals', 'The model is applicable to only certain parts of the service value system', 'Organizations should use an additional model or method to link improvements to customer value'];The flow of the model helps organizations to link improvements to its goals;guiding principle
302;What is the definition of warranty?;['A means of identifying events that could cause harm or loss', 'A means of determining whether a service is fit for purpose', 'A means of identifying a result for a stakeholder', 'A means of determining whether a service is fit for use'];A means of determining whether a service is fit for use;service
303;Which practice has a purpose that includes managing risks to confidentiality, integrity and availability?;['Information security management', 'Change enablement', 'Problem management', 'Service configuration management'];Information security management;management
304;Which statement about value creating activities is CORRECT?;['Each value stream should be designed with a specific combination of service value chain activities', 'Service value chain activities have pre-determined dependencies on ITIL practices', 'A value stream is an operating model for creating value through products and services', 'Organizations should ensure that each value stream is applicable to many scenarios'];Each value stream should be designed with a specific combination of service value chain activities;value chain
305;Which is provided by the 'engage' value chain activity?;['Ensuring that stakeholder expectations for quality are met', 'Ensuring that stakeholder needs are understood by the organization', 'Ensuring that service components are available when needed', 'Ensuring that services are operated to meet agreed specifications'];Ensuring that stakeholder needs are understood by the organization;value chain
306;Which is part of the 'focus on value' guiding principle?;['Understanding what services help the service consumer', 'Reducing the number of steps in the customer experience', 'Assessing services to identify parts that can be reused', 'Identifying activities that can be achieved in smaller iterations'];Understanding what services help the service consumer;guiding principle
307;Which is part of the definition of a customer?;['The role that defines the requirements for a service', 'A means of enabling value co-creation', 'The role that authorizes budget for service consumption', 'A set of specialized organizational capabilities for enabling value'];The role that defines the requirements for a service;service
308;Which guiding principle helps an organization to understand the impact of an altered element on other elements in a system?;['Focus on value', 'Start where you are', 'Think and work holistically', 'Keep it simple and practical'];Think and work holistically;guiding principle
309;Identify the missing words in the following sentence.<br>The 'incident management' practice should maintain [?] for logging and managing incidents.;['a dedicated team', 'a formal process', 'detailed procedures', 'a value chain activity'];detailed procedures;problem/incident/emergency
310;An organization asks a stakeholder to review a planned change. Which guiding principle does this demonstrate?;['Collaborate and promote visibility', 'Start where you are', 'Focus on value', 'Keep it simple and practical'];Collaborate and promote visibility;guiding principle
311;What is the purpose of the 'deployment management' practice?;['To protect the information needed by the organization to conduct its business', 'To make new and changed services and features available for use', 'To move new or changed components to live environments', 'To plan and manage the full lifecycle of all IT assets.'];To move new or changed components to live environments;management
312;Which two statements about the guiding principles are CORRECT?<br>1. The guiding principles support continual improvement<br>2. Each guiding principle applies to a selection of the available stakeholder groups<br>3. Organizations should decide which one of the guiding principles is relevant to them<br>4. Organizations should consider how the guiding principles interact with each other;['1 and 2', '2 and 3', '3 and 4', '1 and 4'];1 and 4;guiding principle
313;Which statement about change authorities is CORRECT?;['Change authorities are only required for authorizing emergency changes', 'Change authorities are assigned when each change is deployed', 'Change authorities are only required for authorizing normal changes', 'Change authorities are assigned for each type of change and change model'];Change authorities are assigned for each type of change and change model;chenge
314;When is the earliest that a workaround can be documented in 'problem management'?;['After the problem has been logged', 'After the problem has been prioritized', 'After the problem has been analyzed', 'After the problem has been resolved'];After the problem has been analyzed;problem/incident/emergency
315;Which is an activity of 'problem identification'?;['Analyzing information from software developers', 'Establishing problem workarounds', 'Analyzing the cause of problems', 'Establishing potential permanent solutions'];Analyzing information from software developers;problem/incident/emergency
316;Which practice uses technologies such as intelligent telephony systems, a knowledge base and monitoring tools?;['Service configuration management', 'Service desk', 'Problem management', 'Deployment management'];Service desk;service desk
317;Which statement about standard changes is CORRECT?;['A full assessment should be completed each time the change is implemented', 'The change can be implemented with less testing if necessary', 'The appropriate change authority should be assigned to each type of change', 'The change does not require additional authorization'];The change does not require additional authorization;chenge
318;Which two are considered part of the 'organizations and people' dimension of service management?<br>1. Systems of authority<br>2. Culture<br>3. Relationships between organizations<br>4. Workflows;['1 and 2', '2 and 3', '3 and 4', '1 and 4'];1 and 2;management
319;Which statement about the 'service request management' practice is CORRECT?;['Service requests are fulfilled using simple workflows', 'A new workflow is created for each type of request', 'Additional approval is sometimes needed for restoration of service', 'Financial authorization is sometimes required for service requests'];Service requests are fulfilled using simple workflows;service desk
320;What is a cause, or potential cause, of one or more incidents?;['A configuration item', 'A workaround', 'An incident', 'A problem'];A problem;problem/incident/emergency
321;Which statement about a service value stream is CORRECT?;['it uses inputs and outputs prescribed by ITIL', 'It is a service value chain activity', 'It integrates practices for a specific scenario', 'It provides an operating model for service providers'];It integrates practices for a specific scenario;service
322;What term is used to describe whether a service will meet availability, capacity and security requirements?;['Outcomes', 'Value', 'Utility', 'Warranty'];Warranty;service
